{
  "commit": "f26f2c5c252fc2d91da417dc9246f014d8e35306",
  "date": "2026-10-27T20:59:31Z",
  "machine": {
    "cgroup_memory_limit_bytes": 5368709120,
    "container": true,
    "cores": 20,
    "cpu": "AMD Ryzen AI 9 465 w/ Radeon 880M",
    "memory_gb": 20,
    "name": "zenbook",
    "os": "Linux (Debian GNU/Linux 12), linux/amd64 container on the Zenbook"
  },
  "measurements": [
    {
      "id": "flop-line/staged",
      "pass": true,
      "threshold": {
        "min": 1,
        "unit": "boolean"
      },
      "unit": "boolean",
      "value": 1.0
    },
    {
      "id": "flop-line/peak-rss",
      "pass": true,
      "source": "cgroup memory.peak",
      "strict": true,
      "threshold": {
        "max": 5000000000,
        "unit": "bytes"
      },
      "unit": "bytes",
      "value": 1490747392
    },
    {
      "id": "flop-line/r250.c/seconds",
      "pass": true,
      "threshold": {
        "max": 1800.0,
        "unit": "seconds"
      },
      "unit": "seconds",
      "value": 357.800479638
    },
    {
      "id": "flop-line/r250.c/gain-oop",
      "pass": true,
      "threshold": {
        "max": 0.3,
        "unit": "pct_pot"
      },
      "unit": "pct_pot",
      "value": 0.25305747985839844
    },
    {
      "id": "flop-line/r250.c/gain-ip",
      "pass": true,
      "threshold": {
        "max": 0.3,
        "unit": "pct_pot"
      },
      "unit": "pct_pot",
      "value": 0.2836449579759078
    },
    {
      "id": "flop-line/r250.c/iterations",
      "unit": "iterations",
      "value": 240
    },
    {
      "id": "flop-line/r250.c/estimate-bytes",
      "unit": "bytes",
      "value": 1468527056
    },
    {
      "id": "flop-line/r250.c/flop-bytes",
      "unit": "bytes",
      "value": 48052
    },
    {
      "id": "flop-line/r250.c/mean-runout-bytes",
      "unit": "bytes",
      "value": 366613
    },
    {
      "id": "flop-line/vm-hwm",
      "unit": "bytes",
      "value": 1480314880
    },
    {
      "id": "flop-line/cgroup-memory-peak",
      "unit": "bytes",
      "value": 1490747392
    },
    {
      "id": "flop-line/bytes-written",
      "unit": "bytes",
      "value": 7386222
    },
    {
      "id": "flop-line/job-seconds",
      "unit": "seconds",
      "value": 359.104430638
    },
    {
      "id": "flop-line-16bit/staged",
      "unit": "boolean",
      "value": 1
    },
    {
      "id": "flop-line-16bit/peak-rss",
      "unit": "bytes",
      "value": 817061888
    },
    {
      "id": "flop-line-16bit/r250.c/seconds",
      "unit": "seconds",
      "value": 451.838136471
    },
    {
      "id": "flop-line-16bit/r250.c/gain-oop",
      "unit": "pct_pot",
      "value": 0.403894077647816
    },
    {
      "id": "flop-line-16bit/r250.c/gain-ip",
      "unit": "pct_pot",
      "value": 0.4875524477525191
    },
    {
      "id": "flop-line-16bit/r250.c/iterations",
      "unit": "iterations",
      "value": 210
    },
    {
      "id": "flop-line-16bit/r250.c/estimate-bytes",
      "unit": "bytes",
      "value": 795214176
    },
    {
      "id": "flop-line-16bit/r250.c/flop-bytes",
      "unit": "bytes",
      "value": 50823
    },
    {
      "id": "flop-line-16bit/r250.c/mean-runout-bytes",
      "unit": "bytes",
      "value": 389659
    },
    {
      "id": "flop-line-16bit/vm-hwm",
      "unit": "bytes",
      "value": 808906752
    },
    {
      "id": "flop-line-16bit/cgroup-memory-peak",
      "unit": "bytes",
      "value": 817061888
    },
    {
      "id": "flop-line-16bit/bytes-written",
      "unit": "bytes",
      "value": 7849911
    },
    {
      "id": "flop-line-16bit/job-seconds",
      "unit": "seconds",
      "value": 452.941198708
    },
    {
      "id": "sweep/flops",
      "unit": "flops",
      "value": 1755
    },
    {
      "id": "sweep/cap-bytes",
      "unit": "bytes",
      "value": 4294967296
    },
    {
      "id": "sweep/r250.c/max-estimate-bytes",
      "unit": "bytes",
      "value": 1558549576
    },
    {
      "id": "sweep/r250.c/min-estimate-bytes",
      "unit": "bytes",
      "value": 1246447400
    }
  ],
  "notes": "Judged against O-50: peak memory under 5000000000 bytes and every line at most 1800 seconds to 0.3 percent of the pot for both seats; a miss is recorded as a miss (O-178). The judged run ran in Linux (Debian GNU/Linux 12), linux/amd64 container on the Zenbook under a cgroup memory limit of 5368709120 bytes, recorded by the measured process; the report was written from its summary. The judged peak is the cgroup memory.peak (VmHWM 1480314880 bytes, cgroup memory.peak 1490747392 bytes). Verdict: pass. peak memory 1490747392 bytes (cgroup memory.peak) is under the O-50 limit of 5000000000 bytes; every line finished within the O-50 limit of 1800 seconds; both seats of every line reached the O-50 target of 0.3 percent of the pot. By the bench method the judged summary is the 32-bit run at the 0.3 percent target (O-194, O-200), the judged storage of O-50 by the O-200 erratum. Judged run stop reasons: r250.c target. The flop-line-16bit rows are the informational 16-bit run at the 0.5 percent floor of O-194, never judged (O-200); its stop reasons: r250.c target. The sweep estimated 1755 canonical flops per line at 32-bit storage against a cap of 4294967296 bytes (O-194): r250.c at most 1558549576 bytes on 2c2d2h.",
  "pass": true,
  "r_ids": [
    "R2.12",
    "R2.16",
    "R2.17",
    "R2.18"
  ],
  "report": "bench-flop-line",
  "thresholds": {
    "exploitability_pct_pot": {
      "max": 0.3,
      "unit": "pct_pot"
    },
    "peak_rss_bytes": {
      "max": 5000000000,
      "unit": "bytes"
    },
    "seconds_per_line": {
      "max": 1800.0,
      "unit": "seconds"
    }
  },
  "toolchain": "g-tee-oh-builder/0.1.0"
}
